{
  "schemaVersion": "1.0.0",
  "matchId": "5c502052698c85b5eb69dfd0d19b6e3885978e4c9113b13d0d1d4b42f0d5b05e",
  "environment": {
    "id": "fighter-1v1",
    "version": "1.0.0"
  },
  "seed": 4101,
  "configHash": "1024a4dc9375cbc0710a1dcb4e4c15824fda350376e9e456ff5dd19932b3db9f",
  "agents": [
    {
      "id": "bot:aggressive",
      "kind": "bot"
    },
    {
      "id": "bot:spacing",
      "kind": "bot"
    }
  ],
  "decisions": [
    {
      "tick": 0,
      "agentIndex": 0,
      "action": "advance",
      "provider": "bot",
      "endpoint": "bot"
    },
    {
      "tick": 0,
      "agentIndex": 1,
      "action": "advance",
      "provider": "bot",
      "endpoint": "bot"
    },
    {
      "tick": 30,
      "agentIndex": 0,
      "action": "advance",
      "provider": "bot",
      "endpoint": "bot"
    },
    {
      "tick": 30,
      "agentIndex": 1,
      "action": "advance",
      "provider": "bot",
      "endpoint": "bot"
    },
    {
      "tick": 60,
      "agentIndex": 0,
      "action": "attack",
      "provider": "bot",
      "endpoint": "bot"
    },
    {
      "tick": 60,
      "agentIndex": 1,
      "action": "block",
      "provider": "bot",
      "endpoint": "bot"
    },
    {
      "tick": 90,
      "agentIndex": 1,
      "action": "attack",
      "provider": "bot",
      "endpoint": "bot"
    },
    {
      "tick": 150,
      "agentIndex": 0,
      "action": "attack",
      "provider": "bot",
      "endpoint": "bot"
    },
    {
      "tick": 150,
      "agentIndex": 1,
      "action": "block",
      "provider": "bot",
      "endpoint": "bot"
    },
    {
      "tick": 180,
      "agentIndex": 1,
      "action": "attack",
      "provider": "bot",
      "endpoint": "bot"
    },
    {
      "tick": 240,
      "agentIndex": 0,
      "action": "attack",
      "provider": "bot",
      "endpoint": "bot"
    },
    {
      "tick": 240,
      "agentIndex": 1,
      "action": "block",
      "provider": "bot",
      "endpoint": "bot"
    },
    {
      "tick": 270,
      "agentIndex": 1,
      "action": "attack",
      "provider": "bot",
      "endpoint": "bot"
    },
    {
      "tick": 330,
      "agentIndex": 0,
      "action": "attack",
      "provider": "bot",
      "endpoint": "bot"
    },
    {
      "tick": 330,
      "agentIndex": 1,
      "action": "block",
      "provider": "bot",
      "endpoint": "bot"
    },
    {
      "tick": 360,
      "agentIndex": 1,
      "action": "attack",
      "provider": "bot",
      "endpoint": "bot"
    },
    {
      "tick": 420,
      "agentIndex": 0,
      "action": "attack",
      "provider": "bot",
      "endpoint": "bot"
    },
    {
      "tick": 420,
      "agentIndex": 1,
      "action": "block",
      "provider": "bot",
      "endpoint": "bot"
    },
    {
      "tick": 450,
      "agentIndex": 1,
      "action": "attack",
      "provider": "bot",
      "endpoint": "bot"
    },
    {
      "tick": 510,
      "agentIndex": 0,
      "action": "attack",
      "provider": "bot",
      "endpoint": "bot"
    },
    {
      "tick": 510,
      "agentIndex": 1,
      "action": "block",
      "provider": "bot",
      "endpoint": "bot"
    },
    {
      "tick": 540,
      "agentIndex": 1,
      "action": "attack",
      "provider": "bot",
      "endpoint": "bot"
    },
    {
      "tick": 600,
      "agentIndex": 0,
      "action": "attack",
      "provider": "bot",
      "endpoint": "bot"
    },
    {
      "tick": 600,
      "agentIndex": 1,
      "action": "block",
      "provider": "bot",
      "endpoint": "bot"
    },
    {
      "tick": 630,
      "agentIndex": 1,
      "action": "attack",
      "provider": "bot",
      "endpoint": "bot"
    },
    {
      "tick": 690,
      "agentIndex": 0,
      "action": "attack",
      "provider": "bot",
      "endpoint": "bot"
    },
    {
      "tick": 690,
      "agentIndex": 1,
      "action": "block",
      "provider": "bot",
      "endpoint": "bot"
    },
    {
      "tick": 720,
      "agentIndex": 1,
      "action": "attack",
      "provider": "bot",
      "endpoint": "bot"
    },
    {
      "tick": 780,
      "agentIndex": 0,
      "action": "attack",
      "provider": "bot",
      "endpoint": "bot"
    },
    {
      "tick": 780,
      "agentIndex": 1,
      "action": "block",
      "provider": "bot",
      "endpoint": "bot"
    },
    {
      "tick": 810,
      "agentIndex": 1,
      "action": "attack",
      "provider": "bot",
      "endpoint": "bot"
    },
    {
      "tick": 870,
      "agentIndex": 0,
      "action": "attack",
      "provider": "bot",
      "endpoint": "bot"
    },
    {
      "tick": 870,
      "agentIndex": 1,
      "action": "block",
      "provider": "bot",
      "endpoint": "bot"
    },
    {
      "tick": 900,
      "agentIndex": 1,
      "action": "attack",
      "provider": "bot",
      "endpoint": "bot"
    },
    {
      "tick": 960,
      "agentIndex": 0,
      "action": "attack",
      "provider": "bot",
      "endpoint": "bot"
    },
    {
      "tick": 960,
      "agentIndex": 1,
      "action": "block",
      "provider": "bot",
      "endpoint": "bot"
    },
    {
      "tick": 990,
      "agentIndex": 1,
      "action": "attack",
      "provider": "bot",
      "endpoint": "bot"
    },
    {
      "tick": 1050,
      "agentIndex": 0,
      "action": "attack",
      "provider": "bot",
      "endpoint": "bot"
    },
    {
      "tick": 1050,
      "agentIndex": 1,
      "action": "block",
      "provider": "bot",
      "endpoint": "bot"
    },
    {
      "tick": 1080,
      "agentIndex": 1,
      "action": "attack",
      "provider": "bot",
      "endpoint": "bot"
    },
    {
      "tick": 1140,
      "agentIndex": 0,
      "action": "attack",
      "provider": "bot",
      "endpoint": "bot"
    },
    {
      "tick": 1140,
      "agentIndex": 1,
      "action": "block",
      "provider": "bot",
      "endpoint": "bot"
    },
    {
      "tick": 1170,
      "agentIndex": 1,
      "action": "attack",
      "provider": "bot",
      "endpoint": "bot"
    }
  ],
  "result": {
    "outcome": "p2",
    "endTick": 1200,
    "endReason": "timeout",
    "healthRemaining": [
      3,
      100
    ]
  },
  "finalStateHash": "72330a8aec6636377c4ddc4e82ae1338ffd0956d35aa6fc0ee3db7c2816b0579",
  "reasoningSidecar": "demo.reasoning.json"
}
